{
  "schemaVersion": 1,
  "package": "@poa-box/core",
  "minimumPackageVersion": "2.1.0",
  "evidence": "Repository follow-up recipes executed against an isolated distributed SDK. Not a new runtime, consent token, deployed-data guarantee or modification of published 2.1.0.",
  "defaults": {
    "signs": false,
    "broadcasts": false,
    "requiresExplicitHostCapabilities": true
  },
  "recipes": [
    {
      "id": "read-organization",
      "title": "Resolve supported organization modules",
      "inputs": [
        {
          "name": "client",
          "type": "GraphClient",
          "unit": "injected transport",
          "required": true,
          "description": "Host-configured public indexed reader; no signer or environment lookup."
        },
        {
          "name": "orgIdOrName",
          "type": "string",
          "unit": "bytes32 org ID or exact name",
          "required": true,
          "description": "An explicit organization on the selected chain."
        },
        {
          "name": "chainId",
          "type": "number",
          "unit": "positive safe integer chain ID",
          "required": true,
          "description": "Keep endpoint and organization scope on this chain."
        }
      ],
      "apis": [
        {
          "module": "@poa-box/core/reads/resolve",
          "exports": [
            "resolveOrgModules"
          ]
        },
        {
          "module": "@poa-box/core/reads/authority",
          "exports": [
            "readAuthoritySnapshot"
          ]
        }
      ],
      "effects": {
        "indexedReads": true,
        "rpcReads": false,
        "mayPublish": false,
        "signs": false,
        "broadcasts": false,
        "persists": false
      },
      "steps": [
        {
          "id": "step-1",
          "calls": [
            {
              "module": "@poa-box/core/reads/resolve",
              "export": "resolveOrgModules"
            }
          ],
          "instruction": "Resolve the supported organization with resolveOrgModules(client, orgIdOrName, chainId)."
        },
        {
          "id": "step-2",
          "calls": [
            {
              "module": "@poa-box/core/reads/authority",
              "export": "readAuthoritySnapshot"
            }
          ],
          "instruction": "Treat nullable optional module addresses as absent. For current authority/permissions obtain complete pinned authority evidence separately."
        }
      ],
      "outputs": [
        {
          "path": "return",
          "type": "Promise<OrgModules>",
          "description": "Promise<OrgModules>; optional modules are nullable; errors reject rather than produce an empty organization."
        }
      ],
      "branches": [
        {
          "when": "read rejects or organization is retired/unready",
          "action": "Surface unavailable; do not substitute another org or invent module addresses."
        },
        {
          "when": "modules resolve",
          "action": "Use addresses to prepare inputs; this does not prove write authorization."
        }
      ],
      "example": {
        "document": "docs/getting-started.md",
        "marker": "task-recipes",
        "export": "resolveOrgModules"
      },
      "hostActions": [
        "No signing, publication or dispatch; host owns read scheduling and cancellation."
      ],
      "retry": {
        "safeToRepeat": "Repeat current scoped bounded reads; retain incomplete/unknown evidence.",
        "afterUncertainty": "Keep the original unsigned recovery barrier. No automatic resend."
      }
    },
    {
      "id": "prepare-task",
      "title": "Prepare an unsigned task with explicit raw reward",
      "inputs": [
        {
          "name": "taskManagerAddress",
          "type": "string",
          "unit": "nonzero EVM address",
          "required": true,
          "description": "Resolved deployed current TaskManager."
        },
        {
          "name": "projectId",
          "type": "string",
          "unit": "bytes32",
          "required": true,
          "description": "Exact TaskManager project ID; not a subject ID."
        },
        {
          "name": "title",
          "type": "string",
          "unit": "1..256 UTF-8 bytes",
          "required": true,
          "description": "Reviewed task title."
        },
        {
          "name": "payoutRaw",
          "type": "string",
          "unit": "positive raw participation-asset base units, uint96 and <=1e24",
          "required": true,
          "description": "Never human Shares or native value; no automatic amount derivation."
        },
        {
          "name": "metadataHash",
          "type": "string",
          "unit": "zero bytes32, nonzero bytes32 or CIDv0",
          "required": true,
          "description": "Explicit zero means no metadata; otherwise store canonical bytes separately."
        },
        {
          "name": "features",
          "type": "TaskManagerFeatures",
          "unit": "deployed capability facts",
          "required": true,
          "description": "Current signature requires deadlines:true; a caller flag is not deployment proof."
        },
        {
          "name": "absoluteDeadline",
          "type": "string",
          "unit": "uint48 Unix seconds",
          "required": false,
          "description": "Zero disables absolute cutoff."
        },
        {
          "name": "completionWindow",
          "type": "string",
          "unit": "uint32 seconds",
          "required": false,
          "description": "Zero disables completion window."
        },
        {
          "name": "bountyToken / bountyPayoutRaw",
          "type": "string / string",
          "unit": "EVM address / raw selected-asset base units",
          "required": false,
          "description": "Supply the nonzero token and positive raw amount together; not native intent.value."
        }
      ],
      "apis": [
        {
          "module": "@poa-box/core/tx/task",
          "exports": [
            "buildCreateTaskRaw"
          ]
        },
        {
          "module": "@poa-box/core/metadata/task",
          "exports": [
            "buildTaskMetadata",
            "serializeTaskMetadata"
          ]
        },
        {
          "module": "@poa-box/core/tx/intent",
          "exports": [
            "intentToExecutionRequest"
          ]
        }
      ],
      "effects": {
        "indexedReads": false,
        "rpcReads": false,
        "mayPublish": false,
        "signs": false,
        "broadcasts": false,
        "persists": false
      },
      "steps": [
        {
          "id": "step-1",
          "calls": [
            {
              "module": "@poa-box/core/metadata/task",
              "export": "buildTaskMetadata"
            },
            {
              "module": "@poa-box/core/metadata/task",
              "export": "serializeTaskMetadata"
            }
          ],
          "instruction": "Build canonical metadata if needed; publishing it is an explicit host-approved step outside this pure recipe."
        },
        {
          "id": "step-2",
          "calls": [
            {
              "module": "@poa-box/core/tx/task",
              "export": "buildCreateTaskRaw"
            }
          ],
          "instruction": "Call buildCreateTaskRaw with exact deployed features and reviewed raw inputs."
        },
        {
          "id": "step-3",
          "calls": [],
          "instruction": "Preview the returned intent. Hand off only after current permission/funding checks and host approval."
        }
      ],
      "outputs": [
        {
          "path": "return",
          "type": "TxIntent",
          "description": "TxIntent, not a status wrapper; no metadata publication, signing or sending occurs."
        }
      ],
      "branches": [
        {
          "when": "builder throws",
          "action": "Keep the form and correct invalid amounts/IDs/features; no dispatch occurred."
        },
        {
          "when": "intent returned",
          "action": "Unsigned preparation only; unknown authorization cannot be treated as approval."
        }
      ],
      "example": {
        "document": "docs/getting-started.md",
        "marker": "task-recipes",
        "export": "prepareTask"
      },
      "hostActions": [
        "Host must obtain approval and persist exact unsigned identity under an account lock before any real wallet dispatch; this pure preparation never sends.",
        "If content must be published, obtain separate publication approval and retain successful/uncertain receipts before retrying."
      ],
      "retry": {
        "safeToRepeat": "Pure unsigned preparation may be repeated after correcting input; it never republishes content or sends a transaction.",
        "afterUncertainty": "Keep the original unsigned recovery barrier. No automatic resend."
      }
    },
    {
      "id": "prepare-poll",
      "title": "Prepare an informational DirectDemocracy poll",
      "inputs": [
        {
          "name": "votingAddress",
          "type": "string",
          "unit": "nonzero EVM address",
          "required": true,
          "description": "Resolved DirectDemocracy voting module."
        },
        {
          "name": "title",
          "type": "string",
          "unit": "UTF-8 text",
          "required": true,
          "description": "Reviewed title."
        },
        {
          "name": "descriptionHash",
          "type": "string",
          "unit": "bytes32",
          "required": true,
          "description": "Canonical proposal document pointer from an explicitly approved publisher, or explicit empty pointer."
        },
        {
          "name": "durationMinutes",
          "type": "string",
          "unit": "integer minutes within deployed contract limits",
          "required": true,
          "description": "Do not pass hours or seconds."
        },
        {
          "name": "numOptions",